{
  "schema_version": "1.0",
  "timestamp": 1735689600,
  "generated_at": "2025-01-01T00:00:02Z",
  "context": {
    "daypart": "morning",
    "rain_expected": false
  },
  "leds": [
    {
      "index": 0,
      "health": "OK",
      "activity_level": 0.2,
      "activity_type": "idle"
    }
  ]
}
